{
  "schema_version": "0.2.1",
  "producer": {
    "run_id": "RUN-EXAMPLE-001",
    "node_id": "NODE-P01-PREPARE",
    "attempt_id": "ATT-001",
    "skill_name": "cs-runtime"
  },
  "status": "succeeded",
  "config_sha256": "aaaaaaaaaaaaaaaaaaaaaaaaaaaaaaaaaaaaaaaaaaaaaaaaaaaaaaaaaaaaaaaa",
  "input_artifacts": [
    {
      "role": "dataset",
      "path": "C:/data/example/input.csv",
      "sha256": "bbbbbbbbbbbbbbbbbbbbbbbbbbbbbbbbbbbbbbbbbbbbbbbbbbbbbbbbbbbbbbbb"
    }
  ],
  "artifacts": [
    {
      "artifact_id": "ART|0123456789abcdef",
      "role": "compounds",
      "path": "compounds.csv",
      "media_type": "text/csv",
      "schema": "compounds@0.2.1",
      "rows": 100,
      "sha256": "cccccccccccccccccccccccccccccccccccccccccccccccccccccccccccccccc"
    }
  ],
  "metrics": {
    "compound_count": 100
  },
  "warnings": [],
  "created_at": "2026-09-17T00:00:00Z"
}
